{
  "metadata": {
    "dataName": "Fe–terephthalate MOF synthesis",
    "creationDate": "2026-04-28",
    "generatorVersion": "1.0",
    "publicationDOI": "",
    "procedureStatus": "test",
    "name": "Ciftci, Esengul",
    "email": "e.ciftci@fkf.mpg.de",
    "orcid": "0000-0002-4994-3486",
    "address": "Heisenbergstrasse 1, 70569, Stuttgart, Germany"
  },
  "productInfo": {
    "type": "porous framework material",
    "systematicName": "",
    "state": "solid",
    "color": "",
    "handlingAtmosphere": "air"
  },
  "synthesisGeneral": {
    "performedDate": "",
    "reactionType": "mix",
    "reactionAtmosphere": "air",
    "temperatureController": "",
    "productAmountUnit": "",
    "scale": "milligram"
  },
  "steps": {
    "preparationAtmosphere": "Air",
    "reactionAtmosphere": "Air",
    "workupAtmosphere": "Air"
  }
}
