{
  "metadata": {
    "dataName": "MOCOF-1",
    "creationDate": "2023-01-01",
    "generatorVersion": "1.0",
    "publicationDOI": "todo",
    "procedureStatus": "success",
    "name": "Endo, Kenichi",
    "email": "kenichi.endo.2@ipoc.uni-stuttgart.de",
    "orcid": "0000-0002-4128-6514",
    "address": "Pfaffenwaldring 55, 70569 Stuttgart, Germany"
  },
  "productInfo": {
    "type": "composite",
    "systematicName": "MOCOF-1",
    "state": "solid",
    "color": "white",
    "handlingAtmosphere": "air"
  },
  "synthesisGeneral": {
    "performedDate": "2023-01-01",
    "labTemperature": 24,
    "labHumidity": 35,
    "reactionType": "mix",
    "temperatureController": "microwave",
    "productAmountUnit": "",
    "scale": "milligram"
  },
  "steps": {
    "preparationAtmosphere": "Air",
    "reactionAtmosphere": "Air",
    "workupAtmosphere": "Air"
  }
}